relative_path	basename	top_folder	extension	size_bytes	modified_date	entity_type	disease	geography	method	surveillance_mode	elimination_phase	diagnostic_test	project_link	phd_article_link	relevance_note	status
Diagnostics/A card-agglutination test with stained trypanosomes (C.A.T.T.) for the serological diagnosis of T.B. gambiense trypanosomiasis.pdf	A card-agglutination test with stained trypanosomes (C.A.T.T.) for the serological diagnosis of T.B. gambiense trypanosomiasis.pdf	Diagnostics	pdf	350240	2024-04-04	Paper	gHAT / HAT			Screening / diagnosis			PhD / sleeping-sickness			to_triage
Diagnostics/A CATT Negative Result after Treatment for Human African Trypanosomiasis Is No Indication for Cure.pdf	A CATT Negative Result after Treatment for Human African Trypanosomiasis Is No Indication for Cure.pdf	Diagnostics	pdf	174374	2024-04-15	Paper	gHAT / HAT	Africa		Screening / diagnosis		CATT	PhD / sleeping-sickness			to_triage
Diagnostics/A Phase III Diagnostic Accuracy Study of a Rapid Diagnostic Test for Diagnosis of Second-Stage Human African Trypanosomiasis in the.pdf	A Phase III Diagnostic Accuracy Study of a Rapid Diagnostic Test for Diagnosis of Second-Stage Human African Trypanosomiasis in the.pdf	Diagnostics	pdf	309137	2022-12-12	Paper	gHAT / HAT	Africa	diagnostic evaluation	Screening / diagnosis			PhD / sleeping-sickness	Article 3: test performance and quality	High relevance to diagnostic performance article	seeded
Diagnostics/Accuracy of individual rapid tests for serodiagnosis of gambiense sleeping sickness in West Africa.pdf	Accuracy of individual rapid tests for serodiagnosis of gambiense sleeping sickness in West Africa.pdf	Diagnostics	pdf	143441	2024-04-15	Paper	gHAT / HAT	West Africa		Screening / diagnosis			PhD / sleeping-sickness			to_triage
Diagnostics/Buscher.zip	Buscher.zip	Diagnostics	zip	4831548	2022-12-21	Paper	gHAT / HAT			Screening / diagnosis			PhD / sleeping-sickness			to_triage
Diagnostics/CATT scale.pdf	CATT scale.pdf	Diagnostics	pdf	125622	2024-06-06	Paper	gHAT / HAT			Screening / diagnosis		CATT	PhD / sleeping-sickness			to_triage
Diagnostics/DevelopmentAndImplementationOfAStrategyForIntensifiedScreeningForgambienseHATinCOngoCentralDRC2020.pdf	DevelopmentAndImplementationOfAStrategyForIntensifiedScreeningForgambienseHATinCOngoCentralDRC2020.pdf	Diagnostics	pdf	3770593	2022-12-16	Paper	gHAT / HAT			Screening / diagnosis			PhD / sleeping-sickness			to_triage
Diagnostics/Diagnosis - the future.pdf	Diagnosis - the future.pdf	Diagnostics	pdf	1132471	2024-03-28	Paper	gHAT / HAT			Screening / diagnosis			PhD / sleeping-sickness			to_triage
Diagnostics/Diagnostic Accuracy and Feasibility of Serological Tests on Filter Paper Samples for Outbreak.pdf	Diagnostic Accuracy and Feasibility of Serological Tests on Filter Paper Samples for Outbreak.pdf	Diagnostics	pdf	522727	2024-03-25	Paper	gHAT / HAT		diagnostic evaluation	Screening / diagnosis			PhD / sleeping-sickness	Article 3: test performance and quality	High relevance to diagnostic performance article	seeded
Diagnostics/Diagnostic Accuracy of Loopamp Trypanosoma brucei Detection Kit for Diagnosis of Human African Trypanosomiasis in Clinical Samples.pdf	Diagnostic Accuracy of Loopamp Trypanosoma brucei Detection Kit for Diagnosis of Human African Trypanosomiasis in Clinical Samples.pdf	Diagnostics	pdf	148589	2024-03-29	Paper	gHAT / HAT	Africa	diagnostic evaluation	Screening / diagnosis		LAMP	PhD / sleeping-sickness	Article 3: test performance and quality	High relevance to diagnostic performance article	seeded
Diagnostics/DiagnosticsExplained.docx	DiagnosticsExplained.docx	Diagnostics	docx	21419	2022-12-21	Paper	gHAT / HAT			Screening / diagnosis			PhD / sleeping-sickness			to_triage
Diagnostics/Feasibility of a dried blood spot strategy for serological screening and surveillance to monitor elimination of Human African Trypanosomiasis in the Democratic.pdf	Feasibility of a dried blood spot strategy for serological screening and surveillance to monitor elimination of Human African Trypanosomiasis in the Democratic.pdf	Diagnostics	pdf	1852718	2023-11-02	Paper	gHAT / HAT	Africa		Screening / diagnosis	Elimination		PhD / sleeping-sickness			to_triage
Diagnostics/HAT_ScoreDePresumptionEnCongo.pdf	HAT_ScoreDePresumptionEnCongo.pdf	Diagnostics	pdf	1298960	2022-12-23	Paper	gHAT / HAT			Screening / diagnosis			PhD / sleeping-sickness			to_triage
Diagnostics/Immune trypanolysis test as a promising bioassay to monitor the elimination of gambiense human African trypanosomiasis.pdf	Immune trypanolysis test as a promising bioassay to monitor the elimination of gambiense human African trypanosomiasis.pdf	Diagnostics	pdf	485792	2025-02-26	Paper	gHAT / HAT	Africa	diagnostic evaluation	Screening / diagnosis	Elimination	Trypanolysis	PhD / sleeping-sickness	Article 3: test performance and quality		seeded
Diagnostics/Innovative digital technologies for quality assurance.pdf	Innovative digital technologies for quality assurance.pdf	Diagnostics	pdf	11055978	2023-11-02	Paper	gHAT / HAT		quality assurance / digital health	Screening / diagnosis			PhD / sleeping-sickness	Article 3: test performance and quality	Supports surveillance quality and digital workflow questions	seeded
Diagnostics/LAB-03-mAECT-V1.0-2021-11-08.pdf	LAB-03-mAECT-V1.0-2021-11-08.pdf	Diagnostics	pdf	302527	2022-12-08	Paper	gHAT / HAT		diagnostic evaluation	Screening / diagnosis		mAECT	PhD / sleeping-sickness	Article 3: test performance and quality		seeded
Diagnostics/Masters of Disguise - Antigenic Variation and VSG coat in tryp brucei.pdf	Masters of Disguise - Antigenic Variation and VSG coat in tryp brucei.pdf	Diagnostics	pdf	809092	2024-05-25	Paper	gHAT / HAT			Screening / diagnosis			PhD / sleeping-sickness			to_triage
Diagnostics/masterthesis_Danel_Niki.pdf	masterthesis_Danel_Niki.pdf	Diagnostics	pdf	15661728	2023-06-25	Paper	gHAT / HAT			Screening / diagnosis			PhD / sleeping-sickness			to_triage
Diagnostics/MSC-Français_centrifugation modifiée du LCR detection tryp.pdf	MSC-Français_centrifugation modifiée du LCR detection tryp.pdf	Diagnostics	pdf	69210	2022-12-14	Paper	gHAT / HAT			Screening / diagnosis			PhD / sleeping-sickness			to_triage
Diagnostics/Overview of the Diagnostic Methods Used in in the field for HAT - What could change.pdf	Overview of the Diagnostic Methods Used in in the field for HAT - What could change.pdf	Diagnostics	pdf	993271	2024-03-25	Paper	gHAT / HAT			Screening / diagnosis			PhD / sleeping-sickness			to_triage
Diagnostics/Palmer JJ et al. Syndromic algorithms for detection of gambiense human.pdf	Palmer JJ et al. Syndromic algorithms for detection of gambiense human.pdf	Diagnostics	pdf	220306	2023-01-06	Paper	gHAT / HAT			Screening / diagnosis			PhD / sleeping-sickness			to_triage
Diagnostics/Parasitological diagnosis of sleeping sickness.pdf	Parasitological diagnosis of sleeping sickness.pdf	Diagnostics	pdf	4419565	2024-03-28	Paper	gHAT / HAT			Screening / diagnosis			PhD / sleeping-sickness			to_triage
Diagnostics/Passive surveillance of human African tryp in cote d'ivoire.pdf	Passive surveillance of human African tryp in cote d'ivoire.pdf	Diagnostics	pdf	918800	2022-12-14	Paper	gHAT / HAT	Africa		Passive			PhD / sleeping-sickness			to_triage
Diagnostics/Passive_surveillance_of_human_African_trypanosomia.pdf	Passive_surveillance_of_human_African_trypanosomia.pdf	Diagnostics	pdf	1217129	2025-06-12	Paper	gHAT / HAT	Africa		Passive			PhD / sleeping-sickness			to_triage
Diagnostics/Performance evaluation of a prototype rapid diagnostic test for combined detection of gambiense-human African trypanosomiasis and malaria.pdf	Performance evaluation of a prototype rapid diagnostic test for combined detection of gambiense-human African trypanosomiasis and malaria.pdf	Diagnostics	pdf	9241989	2024-01-22	Paper	gHAT / HAT	Africa	diagnostic evaluation	Screening / diagnosis			PhD / sleeping-sickness	Article 3: test performance and quality	High relevance to diagnostic performance article	seeded
Diagnostics/Performance of clinical signs and symptoms rapid and reference laboratory diagnostic tests.pdf	Performance of clinical signs and symptoms rapid and reference laboratory diagnostic tests.pdf	Diagnostics	pdf	1777524	2023-10-23	Paper	gHAT / HAT		diagnostic evaluation	Screening / diagnosis		Clinical signs	PhD / sleeping-sickness	Article 3: test performance and quality	High relevance to diagnostic performance article	seeded
Diagnostics/Performance of Parasitological and Molecular Techniques for the Diagnosis and Surveillance of Gambiense Sleeping Sickness.pdf	Performance of Parasitological and Molecular Techniques for the Diagnosis and Surveillance of Gambiense Sleeping Sickness.pdf	Diagnostics	pdf	271035	2024-03-31	Paper	gHAT / HAT		diagnostic evaluation	Screening / diagnosis			PhD / sleeping-sickness	Article 3: test performance and quality	High relevance to diagnostic performance article	seeded
Diagnostics/Performance of the SD BIOLINE® HAT rapid test in various diagnostic algorithms for gambiense human African trypanosomiasis in the Democratic Republic of the Congo.pdf	Performance of the SD BIOLINE® HAT rapid test in various diagnostic algorithms for gambiense human African trypanosomiasis in the Democratic Republic of the Congo.pdf	Diagnostics	pdf	2057078	2024-03-25	Paper	gHAT / HAT	DRC	diagnostic evaluation	Screening / diagnosis		RDT	PhD / sleeping-sickness	Article 3: test performance and quality	High relevance to diagnostic performance article	seeded
Diagnostics/PhaseIII_RDT_CORIS.pdf	PhaseIII_RDT_CORIS.pdf	Diagnostics	pdf	309137	2022-12-12	Paper	gHAT / HAT		diagnostic evaluation	Screening / diagnosis			PhD / sleeping-sickness	Article 3: test performance and quality	High relevance to diagnostic performance article	seeded
Diagnostics/Procedure HAT-full.jpg	Procedure HAT-full.jpg	Diagnostics	jpg	137757	2024-06-04	Paper	gHAT / HAT			Screening / diagnosis			PhD / sleeping-sickness			to_triage
Diagnostics/Prospective evaluation of a rapid diagnostic.pdf	Prospective evaluation of a rapid diagnostic.pdf	Diagnostics	pdf	2921106	2024-03-25	Paper	gHAT / HAT		diagnostic evaluation	Screening / diagnosis			PhD / sleeping-sickness	Article 3: test performance and quality		seeded
Diagnostics/qPCR - Specifcity of serological screening tests and reference laboratory tests to diagnose.pdf	qPCR - Specifcity of serological screening tests and reference laboratory tests to diagnose.pdf	Diagnostics	pdf	2336698	2025-02-26	Paper	gHAT / HAT		diagnostic evaluation	Screening / diagnosis		Molecular	PhD / sleeping-sickness	Article 3: test performance and quality		seeded
Diagnostics/Rapid Diagnostic Test for Sleeping Sickness.pdf	Rapid Diagnostic Test for Sleeping Sickness.pdf	Diagnostics	pdf	367710	2024-04-19	Paper	gHAT / HAT		diagnostic evaluation	Screening / diagnosis			PhD / sleeping-sickness	Article 3: test performance and quality		seeded
Diagnostics/Sensitivity and Specificity of a Prototype rapid diagnostic test for the detection of trypanosoma brucei gambiense infection.pdf	Sensitivity and Specificity of a Prototype rapid diagnostic test for the detection of trypanosoma brucei gambiense infection.pdf	Diagnostics	pdf	924467	2024-05-27	Paper	gHAT / HAT		diagnostic evaluation	Screening / diagnosis			PhD / sleeping-sickness	Article 3: test performance and quality	High relevance to diagnostic performance article	seeded
Diagnostics/Sensitivity and specificity of HAT Sero-K-SeT, a rapid diagnostic test for serodiagnosis of sleeping sickness caused by Trypanosoma brucei gambiense - a case-control study.pdf	Sensitivity and specificity of HAT Sero-K-SeT, a rapid diagnostic test for serodiagnosis of sleeping sickness caused by Trypanosoma brucei gambiense - a case-control study.pdf	Diagnostics	pdf	230106	2024-03-25	Paper	gHAT / HAT		diagnostic evaluation	Screening / diagnosis		HAT Sero-K-SeT	PhD / sleeping-sickness	Article 3: test performance and quality	High relevance to diagnostic performance article	seeded
Diagnostics/serological_tests_overview__STA_PB.docx	serological_tests_overview__STA_PB.docx	Diagnostics	docx	625530	2024-04-02	Paper	gHAT / HAT			Screening / diagnosis			PhD / sleeping-sickness			to_triage
Diagnostics/Simple centrifugationLCR_sealedPasteurPipette.pdf	Simple centrifugationLCR_sealedPasteurPipette.pdf	Diagnostics	pdf	256930	2022-12-14	Paper	gHAT / HAT			Screening / diagnosis			PhD / sleeping-sickness			to_triage
Diagnostics/SOP CATT T evansi.pdf	SOP CATT T evansi.pdf	Diagnostics	pdf	293614	2024-04-04	Paper	gHAT / HAT			Screening / diagnosis		CATT	PhD / sleeping-sickness			to_triage
Diagnostics/TARGET PRODUCT PROFILE.pdf	TARGET PRODUCT PROFILE.pdf	Diagnostics	pdf	371933	2024-03-27	Paper	gHAT / HAT			Screening / diagnosis			PhD / sleeping-sickness			to_triage
Diagnostics/Thesis_Sara_Tablado_seropositivity.pdf	Thesis_Sara_Tablado_seropositivity.pdf	Diagnostics	pdf	1340447	2022-12-13	Paper	gHAT / HAT			Screening / diagnosis			PhD / sleeping-sickness			to_triage
Diagnostics/Tropical Med Int Health - 2024 - Tablado Alonso - Retrospective clinical performance evaluation of the Abbott Bioline HAT 2.pdf	Tropical Med Int Health - 2024 - Tablado Alonso - Retrospective clinical performance evaluation of the Abbott Bioline HAT 2.pdf	Diagnostics	pdf	717304	2025-03-06	Paper	gHAT / HAT		diagnostic evaluation	Screening / diagnosis		RDT	PhD / sleeping-sickness	Article 3: test performance and quality	High relevance to diagnostic performance article	seeded
Diagnostics/Trypanosoma brucei gambiense-iELISA A Promising New Test for the Post-Elimination Monitoring of Human African Trypanosomiasis.pdf	Trypanosoma brucei gambiense-iELISA A Promising New Test for the Post-Elimination Monitoring of Human African Trypanosomiasis.pdf	Diagnostics	pdf	396378	2025-02-26	Paper	gHAT / HAT	Africa	diagnostic evaluation	Screening / diagnosis	Post-elimination	iELISA	PhD / sleeping-sickness	Article 3: test performance and quality		seeded
Diagnostics/Trypanosome SL-RNA detection in blood and cerebrospinal fluid to demonstrate active gambiense human African trypanosomiasis infection.pdf	Trypanosome SL-RNA detection in blood and cerebrospinal fluid to demonstrate active gambiense human African trypanosomiasis infection.pdf	Diagnostics	pdf	1143820	2025-02-26	Paper	gHAT / HAT	Africa		Screening / diagnosis		Molecular	PhD / sleeping-sickness	Article 3: test performance and quality		seeded
Diagnostics/Two-year follow-up of gHAT serology after succesful treatment of HAT - results of four different sero-diagnostic tests.pdf	Two-year follow-up of gHAT serology after succesful treatment of HAT - results of four different sero-diagnostic tests.pdf	Diagnostics	pdf	1172115	2024-03-25	Paper	gHAT / HAT		diagnostic evaluation	Screening / diagnosis			PhD / sleeping-sickness		High relevance to diagnostic performance article	to_triage
Diagnostics/Two-Year Follow-Up of Trypanosoma brucei gambiense Serology after Successful Treatment of Human African Trypanosomiasis Results of Four Different Sero-Diagnostic Tests.pdf	Two-Year Follow-Up of Trypanosoma brucei gambiense Serology after Successful Treatment of Human African Trypanosomiasis Results of Four Different Sero-Diagnostic Tests.pdf	Diagnostics	pdf	1172115	2024-04-01	Paper	gHAT / HAT	Africa	diagnostic evaluation	Screening / diagnosis			PhD / sleeping-sickness		High relevance to diagnostic performance article	to_triage
Diagnostics/Understanding the Role of the Diagnostic 'Reflex' in the Elimination of Human African Trypanosomiasis.pdf	Understanding the Role of the Diagnostic 'Reflex' in the Elimination of Human African Trypanosomiasis.pdf	Diagnostics	pdf	512430	2024-01-15	Paper	gHAT / HAT	Africa		Screening / diagnosis	Elimination		PhD / sleeping-sickness			to_triage
Diagnostics/Validite_cout_et_faisabilite_de_la_mAECT.pdf	Validite_cout_et_faisabilite_de_la_mAECT.pdf	Diagnostics	pdf	115582	2024-06-27	Paper	gHAT / HAT		diagnostic evaluation	Screening / diagnosis		mAECT	PhD / sleeping-sickness	Article 3: test performance and quality		seeded
Diagnostics/VariantSpecificTrypanolysis.pdf	VariantSpecificTrypanolysis.pdf	Diagnostics	pdf	608444	2022-12-21	Paper	gHAT / HAT		diagnostic evaluation	Screening / diagnosis		Trypanolysis	PhD / sleeping-sickness	Article 3: test performance and quality		seeded
Diagnostics/WHO_TTP_Wider treatment.pdf	WHO_TTP_Wider treatment.pdf	Diagnostics	pdf	360657	2026-03-19	Paper	gHAT / HAT			Screening / diagnosis			PhD / sleeping-sickness			to_triage
Elimination/2022 alvares elimination HAT possible.pdf	2022 alvares elimination HAT possible.pdf	Elimination	pdf	2634127	2024-09-06	Paper	gHAT / HAT				Elimination		PhD / sleeping-sickness			to_triage
Elimination/BumpyRoadToElimination.pdf	BumpyRoadToElimination.pdf	Elimination	pdf	722433	2022-12-06	Paper	gHAT / HAT				Elimination		PhD / sleeping-sickness			to_triage
Elimination/Criteria and procedures for the verification of elimination of transmission of t.b. gambiense to the human population in a given country.pdf	Criteria and procedures for the verification of elimination of transmission of t.b. gambiense to the human population in a given country.pdf	Elimination	pdf	1055405	2024-05-17	Paper	gHAT / HAT				Elimination		PhD / sleeping-sickness			to_triage
Elimination/Human_African_trypanosomiasis_cases_diagnosed_in_n.pdf	Human_African_trypanosomiasis_cases_diagnosed_in_n.pdf	Elimination	pdf	1880641	2024-03-25	Paper	gHAT / HAT	Africa			Elimination		PhD / sleeping-sickness			to_triage
Elimination/JVectorBorneDis572105-4496287_122922.pdf	JVectorBorneDis572105-4496287_122922.pdf	Elimination	pdf	1288233	2024-05-16	Paper	gHAT / HAT				Elimination		PhD / sleeping-sickness			to_triage
Elimination/The challenge of serodiagnosis of sleeping sickness in the context of elimination.pdf	The challenge of serodiagnosis of sleeping sickness in the context of elimination.pdf	Elimination	pdf	38059	2024-03-25	Paper	gHAT / HAT				Elimination		PhD / sleeping-sickness			to_triage
Elimination/The elimination of Trypanosoma brucei gambiense - Challenges of reservoir hosts and transmission cycles	The elimination of Trypanosoma brucei gambiense - Challenges of reservoir hosts and transmission cycles	Elimination		670953	2024-01-09	Paper	gHAT / HAT				Elimination		PhD / sleeping-sickness			to_triage
Elimination/The_elimination_of_human_African_trypanosomiasis_A.pdf	The_elimination_of_human_African_trypanosomiasis_A.pdf	Elimination	pdf	2665042	2024-03-25	Paper	gHAT / HAT	Africa			Elimination		PhD / sleeping-sickness			to_triage
Elimination/Towards the sustainable elimination of gambiense human African trypanosomiasis in Côte d'Ivoire using an integrated approach.pdf	Towards the sustainable elimination of gambiense human African trypanosomiasis in Côte d'Ivoire using an integrated approach.pdf	Elimination	pdf	2758999	2023-11-13	Paper	gHAT / HAT	Cote dIvoire			Elimination		PhD / sleeping-sickness			to_triage
Epidemiology/African trypanosomiasis.pdf	African trypanosomiasis.pdf	Epidemiology	pdf	379756	2023-11-30	Paper	gHAT / HAT	Africa					PhD / sleeping-sickness			to_triage
Epidemiology/Do Cryptic Reservoirs Threaten.pdf	Do Cryptic Reservoirs Threaten.pdf	Epidemiology	pdf	2003735	2023-11-13	Paper	gHAT / HAT						PhD / sleeping-sickness			to_triage
Epidemiology/DOMESTIC ANIMALS AS POTENTIAL RESERVOIR HOSTS.pdf	DOMESTIC ANIMALS AS POTENTIAL RESERVOIR HOSTS.pdf	Epidemiology	pdf	197420	2024-05-27	Paper	gHAT / HAT						PhD / sleeping-sickness			to_triage
Epidemiology/Epidemiology of human African trypanosomiasis.pdf	Epidemiology of human African trypanosomiasis.pdf	Epidemiology	pdf	1386307	2023-11-30	Paper	gHAT / HAT	Africa					PhD / sleeping-sickness			to_triage
Epidemiology/Human African trypanosomiasis in the Democratic Republic of the Congo - disease distribution and risk/12942_2015_Article_13.pdf	12942_2015_Article_13.pdf	Epidemiology	pdf	2819012	2024-04-08	Paper	gHAT / HAT	DRC	spatial epidemiology				PhD / sleeping-sickness	Article 1: historical risk mapping and foci	High relevance to historical risk and focus delineation	seeded
Epidemiology/Human African trypanosomiasis in the Democratic Republic of the Congo - disease distribution and risk/Attendance rate in HAT active screening activities in the provinces of DRC (period 2000-2012).docx	Attendance rate in HAT active screening activities in the provinces of DRC (period 2000-2012).docx	Epidemiology	docx	16116	2024-01-22	Paper	gHAT / HAT	DRC	spatial epidemiology	Active			PhD / sleeping-sickness	Article 1: historical risk mapping and foci	High relevance to historical risk and focus delineation	seeded
Epidemiology/Human African trypanosomiasis in the Democratic Republic of the Congo - disease distribution and risk/HAT control and surveillance in the Provinces of DRC (2000-2012).xlsx	HAT control and surveillance in the Provinces of DRC (2000-2012).xlsx	Epidemiology	xlsx	139290	2024-01-22	Paper	gHAT / HAT	DRC	spatial epidemiology		Elimination monitoring		PhD / sleeping-sickness	Article 1: historical risk mapping and foci	High relevance to historical risk and focus delineation	seeded
Epidemiology/Human African trypanosomiasis in the Democratic Republic of the Congo - disease distribution and risk/Human African trypanosomiasis in the Democratic Republic of the Congo disease distribution and risk.pdf	Human African trypanosomiasis in the Democratic Republic of the Congo disease distribution and risk.pdf	Epidemiology	pdf	1227637	2024-01-22	Paper	gHAT / HAT	DRC	spatial epidemiology				PhD / sleeping-sickness	Article 1: historical risk mapping and foci	High relevance to historical risk and focus delineation	seeded
Epidemiology/Human African trypanosomiasis in the Democratic Republic of the Congo - disease distribution and risk/Progress status of mapping for HAT cases and geographic locations in DRC (period 2000 – 2012), and geographical accuracy of mapped villages.docx	Progress status of mapping for HAT cases and geographic locations in DRC (period 2000 – 2012), and geographical accuracy of mapped villages.docx	Epidemiology	docx	19649	2024-01-22	Paper	gHAT / HAT	DRC	spatial epidemiology				PhD / sleeping-sickness	Article 1: historical risk mapping and foci	High relevance to historical risk and focus delineation	seeded
Epidemiology/Human African trypanosomiasis in the Democratic Republic of the Congo - disease distribution and risk/The distribution of HAT in the DRC and its Provinces (2003-2007 and 2008-2012).docx	The distribution of HAT in the DRC and its Provinces (2003-2007 and 2008-2012).docx	Epidemiology	docx	28387811	2024-04-08	Paper	gHAT / HAT	DRC	spatial epidemiology				PhD / sleeping-sickness	Article 1: historical risk mapping and foci	High relevance to historical risk and focus delineation	seeded
Epidemiology/Human African trypanosomiasis in the Democratic Republic of the Congo - disease distribution and risk/The distribution of HAT in the Provinces of DRC (2000-2012).docx	The distribution of HAT in the Provinces of DRC (2000-2012).docx	Epidemiology	docx	13217660	2024-01-22	Paper	gHAT / HAT	DRC	spatial epidemiology				PhD / sleeping-sickness	Article 1: historical risk mapping and foci	High relevance to historical risk and focus delineation	seeded
Epidemiology/Human African trypanosomiasis in the Democratic Republic of the Congo - disease distribution and risk/The risk of HAT in DRC (2003-2007 and 2008-2012).docx	The risk of HAT in DRC (2003-2007 and 2008-2012).docx	Epidemiology	docx	28673	2024-01-22	Paper	gHAT / HAT	DRC	spatial epidemiology				PhD / sleeping-sickness	Article 1: historical risk mapping and foci	High relevance to historical risk and focus delineation	seeded
Epidemiology/Human African trypanosomiasis in the Democratic Republic of the Congo - disease distribution and risk/The risk of HAT in the provinces of DRC (2003-2007 and 2008-2012).docx	The risk of HAT in the provinces of DRC (2003-2007 and 2008-2012).docx	Epidemiology	docx	14357230	2024-01-22	Paper	gHAT / HAT	DRC	spatial epidemiology				PhD / sleeping-sickness	Article 1: historical risk mapping and foci	High relevance to historical risk and focus delineation	seeded
Epidemiology/Prevalence of Human African Trypanosomiasis in the Democratic Republic of the Congo.pdf	Prevalence of Human African Trypanosomiasis in the Democratic Republic of the Congo.pdf	Epidemiology	pdf	320503	2024-01-05	Paper	gHAT / HAT	DRC					PhD / sleeping-sickness			to_triage
Epidemiology/Representation spatiale des deplacements des malades dans un foyer de trypanosomose humaine africaine de Cote d'Ivoire..pdf	Representation spatiale des deplacements des malades dans un foyer de trypanosomose humaine africaine de Cote d'Ivoire..pdf	Epidemiology	pdf	559409	2024-04-08	Paper	gHAT / HAT	Cote dIvoire	spatial epidemiology				PhD / sleeping-sickness			to_triage
Epidemiology/Review of the Situation of Human African Trypanosomiasis in the Republic of Congo From the 1950s to 2020.pdf	Review of the Situation of Human African Trypanosomiasis in the Republic of Congo From the 1950s to 2020.pdf	Epidemiology	pdf	10491755	2024-01-30	Paper	gHAT / HAT	Republic of Congo					PhD / sleeping-sickness			to_triage
Epidemiology/Towards understanding the presenceabsence of Human African Trypanosomosis in a focus of Côte d'Ivoire a spatial analysis of the pathogenic system.pdf	Towards understanding the presenceabsence of Human African Trypanosomosis in a focus of Côte d'Ivoire a spatial analysis of the pathogenic system.pdf	Epidemiology	pdf	4239190	2024-04-08	Paper	gHAT / HAT	Cote dIvoire	spatial epidemiology				PhD / sleeping-sickness			to_triage
Integration/Human African Trypanosomiasis Diagnosis in First-Line Health Services of Endemic Countries, a Systematic Review.pdf	Human African Trypanosomiasis Diagnosis in First-Line Health Services of Endemic Countries, a Systematic Review.pdf	Integration	pdf	311118	2024-01-05	Paper	gHAT / HAT	Africa	implementation research	Passive / integrated			PhD / sleeping-sickness	Article 2/4: passive screening system and integration	High relevance to passive surveillance redesign	seeded
